{
  "schemaVersion": 1,
  "protocol": "computer-use-v8-preview",
  "runtimeVersion": "7.0.0",
  "generatedAt": "2026-07-13T14:43:17.030Z",
  "evidence": [
    {
      "schemaVersion": 1,
      "evidenceId": "evidence_multi_agent_4965fc8bf835c7d3",
      "kind": "deterministic_suite",
      "scope": "multi_agent",
      "observedAt": "2026-07-13T14:43:16.115Z",
      "environment": {
        "platform": "darwin",
        "arch": "arm64",
        "node": "v25.4.0",
        "interactive": false,
        "source": "local"
      },
      "command": "node --test test/v8-reliability-corpus.test.mjs test/v8-mcp-facade.test.mjs",
      "passed": true,
      "tests": 17,
      "durationMs": 388,
      "assertions": [
        "lease.one_writer",
        "lease.terminal_revocation",
        "lease.schedule_10000",
        "reservation.conflict",
        "reservation.no_authority"
      ],
      "sources": [
        {
          "path": "test/v8-mcp-facade.test.mjs",
          "digest": "sha256:440b1e09903a139552471eea095f283209a79c95cc2d72d7e4eb9fe1c38aaacb"
        },
        {
          "path": "test/v8-reliability-corpus.test.mjs",
          "digest": "sha256:b68a21f1cc81079ba240970304c5da4d75f9585a1858357373cc6886373a5e49"
        }
      ],
      "sourceDigest": "sha256:bb2b8d3548e23ecedb8f36f5c7d7d814423f2160d12e44684965fc8bf835c7d3",
      "outputDigest": "sha256:75d5d8bee55178639f90da5d8c2b3646fd71797cbd758ad3e9f3ff1b49bb0a77"
    },
    {
      "schemaVersion": 1,
      "evidenceId": "evidence_policy_73f43849bcfda153",
      "kind": "deterministic_suite",
      "scope": "policy",
      "observedAt": "2026-07-13T14:43:15.725Z",
      "environment": {
        "platform": "darwin",
        "arch": "arm64",
        "node": "v25.4.0",
        "interactive": false,
        "source": "local"
      },
      "command": "node --test test/v8-runtime-kernel.test.mjs test/v8-browser-bridge.test.mjs test/v8-provider-adapters.test.mjs test/v8-provider-examples.test.mjs test/v8-onboarding.test.mjs test/v8-onboarding-ui.test.mjs test/v8-reliability-lab.test.mjs test/v8-release-artifacts.test.mjs test/v8-release-readiness.test.mjs test/v8-registry-action.test.mjs test/v8-migration.test.mjs && npm test --prefix packages/computer-use-remote",
      "passed": true,
      "tests": 115,
      "durationMs": 3036,
      "assertions": [
        "policy.operation_boundaries",
        "policy.approval_binding",
        "policy.untrusted_provenance",
        "target.stale_fail_closed",
        "receipt.exactly_once",
        "onboarding.disclosure_boundary",
        "reliability.evidence_separation",
        "release.artifact_binding",
        "release.mandatory_readiness_gates",
        "remote.os_vault_boundary"
      ],
      "sources": [
        {
          "path": "contracts/v8/adk-evaluation-receipt.schema.json",
          "digest": "sha256:8f2965d4739b82a58ca7721eb79afb9a60023d6128bd612b2ce37969e3440606"
        },
        {
          "path": "contracts/v8/browser-page-evidence.schema.json",
          "digest": "sha256:39b4be1ae87fa7f80c6052ff2cf75081ecfd7b3abff563e08522b74fd8b64302"
        },
        {
          "path": "contracts/v8/release-artifact-manifest.schema.json",
          "digest": "sha256:de67dc45b4e676e31b9e263344864ad2d446f49c566f4d8823d3906348c41d7c"
        },
        {
          "path": "contracts/v8/release-evidence.schema.json",
          "digest": "sha256:9ea3985b08c074b708fe1b76f2bfd9a5dbb0caffe03d6bd1f6898f6b12bc7c82"
        },
        {
          "path": "contracts/v8/release-readiness-report.schema.json",
          "digest": "sha256:fb9e27d303d7b0f5a7c3117e3e6bfd948fe03f0a0177862c3c73b54607ed3249"
        },
        {
          "path": "contracts/v8/reliability-lab-corpus.json",
          "digest": "sha256:6e0bb2cb55352a3e3cfbafaf8af034b8ffda846b972d37071b5d9cffb96b496c"
        },
        {
          "path": "contracts/v8/reliability-lab-corpus.schema.json",
          "digest": "sha256:71ce40336cc341e16d29d9230b11cc4c4ad3f2bb2caa0a993edaabae41c7bff6"
        },
        {
          "path": "contracts/v8/reliability-lab-report.schema.json",
          "digest": "sha256:31f884ea343bdd6663afcaaa5786bb0ecf49dfa9ce638a1a92fd04badc09b38d"
        },
        {
          "path": "contracts/v8/setup-command.schema.json",
          "digest": "sha256:f7aab9076e68948936126e152e2f224487e16e856737ac4345938d482fe5e6b7"
        },
        {
          "path": "contracts/v8/setup-view-model.schema.json",
          "digest": "sha256:e10ac47aae6b0f0a5fab0d450373b3f1c4dea92416599e8bc32639b458bb3b15"
        },
        {
          "path": "docs/conformance/v8/adk-evaluation-receipt-7.0.0.json",
          "digest": "sha256:28f0e35c56bae109769cd83d45b796ef4fbff6e5546257f21e3170542609cbf9"
        },
        {
          "path": "examples/v8-direct-sdk.mjs",
          "digest": "sha256:ae2c9cd95e7007522c09c6e518172944f2df725bb3d4dce02abeb8e67d071f43"
        },
        {
          "path": "examples/v8-electron-setup.mjs",
          "digest": "sha256:8f27501e94c8c0d89f32617327451e212438f55780297cce1cd0651d7d649ae5"
        },
        {
          "path": "examples/v8-langgraph.mjs",
          "digest": "sha256:1cf45889bffd42f104aa6591ae30555533ea351a031cc30868e07526ffd87ec2"
        },
        {
          "path": "examples/v8-setup-ui.mjs",
          "digest": "sha256:81189c4dc71f4885532016a712465fe3f3a8e00deb567acb93a94989c69e5234"
        },
        {
          "path": "examples/v8-tauri-setup.mjs",
          "digest": "sha256:215105eac2ce8bdfc25b00ca2aacd4fcf5b91cff2f82d7203b275d3ed5532944"
        },
        {
          "path": "native/src/keychain.rs",
          "digest": "sha256:c11399c01d85bf9575ca8f11b9c4fd9a02a4415a904b04ae318786b5cbe02b79"
        },
        {
          "path": "native/src/lib.rs",
          "digest": "sha256:078c87eb13ed543850ce8670269affb318093fc194f04d1f99c6bda9a34bdbc1"
        },
        {
          "path": "native/src/permissions.rs",
          "digest": "sha256:8508ec2b43ac12a59bc2f49b5e1bc735e5c4f08381e1bdd9eb4e3398b2a3a735"
        },
        {
          "path": "packages/computer-use-remote/src/cli.mjs",
          "digest": "sha256:f7925e2450c249ea7ca375a577c2cb8d180b20f0d88f1d570b725a0407b40966"
        },
        {
          "path": "packages/computer-use-remote/src/os-vault.mjs",
          "digest": "sha256:cdb5fd715e5b51b2c7d9b5dad85bb73d61458fbc804d57f9eea6b124ec51cdfb"
        },
        {
          "path": "packages/computer-use-remote/src/pairing.mjs",
          "digest": "sha256:c774533cd0342ec6264711c970426eab5e566c752e33fdc052e24ee35024f8b7"
        },
        {
          "path": "packages/computer-use-remote/test/remote.test.mjs",
          "digest": "sha256:67f81cd8cf551326077a0a8899bf0fb1f2a44017e88896236313b6283768f282"
        },
        {
          "path": "release-artifacts.json",
          "digest": "sha256:1f8746abae00b794821da8f55d225065ce10ab0bf3fe0d683879318b7ffb101a"
        },
        {
          "path": "scripts/evaluate-v8-readiness.mjs",
          "digest": "sha256:a9ab8e50abc972be14a1a4709b0752c712ad3d4638c3f48fa42ccfe1137254a9"
        },
        {
          "path": "scripts/generate-release-artifacts.mjs",
          "digest": "sha256:e95c82bbf398a8ab158912ce0d44dd7702aebda799129ccac3ba16434ce6df73"
        },
        {
          "path": "scripts/run-v8-reliability-lab.mjs",
          "digest": "sha256:55cce223889ef1463562075028d5dd32a2460f2f47f3332210403c0ebd083772"
        },
        {
          "path": "src/migration/cli.ts",
          "digest": "sha256:d1ed83e87b415c1a993a24e7f6e0c3f855a04b4c6e6b8fbcb32d21b848160b72"
        },
        {
          "path": "src/migration/v8.ts",
          "digest": "sha256:72953f571b1d29f1c81824621eb88742100325b275782023804e5ccbff337e85"
        },
        {
          "path": "src/native.ts",
          "digest": "sha256:8267a28faa6a47fa3ac4fe99da2ba5a80c02b67c889660274efc36b604cae733"
        },
        {
          "path": "src/onboarding/desktop.ts",
          "digest": "sha256:b18788db47f5da7ac5c42f37e2e547a82f9f8c54d13ff0d65624643c8615a1e2"
        },
        {
          "path": "src/onboarding/terminal.ts",
          "digest": "sha256:8a5ce1f2668e114c0fc9c825b1ab0d73afa3428e45af9e31d5699271abd9a20f"
        },
        {
          "path": "src/onboarding/view-model.ts",
          "digest": "sha256:4257936c70619e4859834add607cb70b1a893c854392e7906d5c050552101b56"
        },
        {
          "path": "src/release/artifacts.ts",
          "digest": "sha256:93d578649f59d7fecf1451942612acbad11e1cbda9e096b04f69379842217728"
        },
        {
          "path": "src/release/readiness.ts",
          "digest": "sha256:66e2de5603969d508e60a497d6809c4e7d05d7f130ac146d678be266646e2229"
        },
        {
          "path": "src/reliability/lab.ts",
          "digest": "sha256:8d58c1b0857a4d1511e726c07e71b1c69f30ca9933294595fde20527a5a92e3b"
        },
        {
          "path": "src/runtime/browser-bridge.ts",
          "digest": "sha256:bedd69e6568e2fb310c2efad63439ae115a64d9864b89ed120a9178a80cfd039"
        },
        {
          "path": "test/v8-browser-bridge.test.mjs",
          "digest": "sha256:5ed3652b0caeb768622d15f236c000ae89d8d270109c58a04918e2fb70abbec6"
        },
        {
          "path": "test/v8-migration.test.mjs",
          "digest": "sha256:80fdf4d339870815c6dabd911b4bff0197bf01687eb2ab237bcb61e0ddc4cfc9"
        },
        {
          "path": "test/v8-onboarding-ui.test.mjs",
          "digest": "sha256:7568676b550ebe27f0471e71bfe4ce05dbe6dc49d6a818709178dbbf2cc258a6"
        },
        {
          "path": "test/v8-onboarding.test.mjs",
          "digest": "sha256:7ae60f973d6e8304426ad15fdad9b0fd2b720a57803df037885a8b84615a4d37"
        },
        {
          "path": "test/v8-provider-adapters.test.mjs",
          "digest": "sha256:d679dfc312259f9952db48a0959f74edcebd7de25c840e24b1dd44b10dd8823b"
        },
        {
          "path": "test/v8-provider-examples.test.mjs",